{
  "$schema": "https://json-schema.org/draft/2020-12/schema",
  "$id": "https://grdr.dev/schemas/database_deep_map_phase_update.schema.json",
  "title": "GRDR database deep-map project phase update",
  "type": "object", "additionalProperties": false,
  "required": ["phase", "state", "completion_basis", "evidence", "blockers"],
  "properties": {
    "phase": {"enum": ["identity", "classification", "boundary", "inventory", "deep_mapping", "validation", "completion_audit"]},
    "state": {"enum": ["not_started", "enumerating", "in_progress", "mapped_complete", "verified_complete", "not_applicable", "blocked"]},
    "completion_basis": {"type": ["string", "null"]},
    "evidence": {"type": "array", "items": {"$ref": "#/$defs/evidence"}},
    "blockers": {"type": "array", "items": {"$ref": "#/$defs/blocker"}}
  },
  "$defs": {
    "evidence": {"type": "object", "additionalProperties": false, "required": ["url", "title", "evidence_type", "supports", "retrieved_at"], "properties": {"url": {"type": "string", "format": "uri"}, "title": {"type": "string", "minLength": 1}, "evidence_type": {"type": "string", "minLength": 1}, "supports": {"type": "array", "items": {"type": "string", "minLength": 1}, "minItems": 1, "uniqueItems": true}, "retrieved_at": {"type": "string", "format": "date-time"}}},
    "blocker": {"type": "object", "additionalProperties": false, "required": ["type", "notes"], "properties": {"type": {"enum": ["access", "authentication", "payment", "license", "privacy", "ethics", "technical", "scale", "missing_metadata", "other"]}, "notes": {"type": "string", "minLength": 1}}}
  }
}
