{
  "phase": "classification",
  "state": "verified_complete",
  "completion_basis": "The database role, origin, production mode, structure, access regime, and required route modules were verified against official documentation.",
  "evidence": [
    {
      "url": "https://datahelpdesk.worldbank.org/knowledgebase/articles/889392-about-the-indicators-api-documentation",
      "title": "About the Indicators API Documentation",
      "evidence_type": "official_documentation",
      "supports": [
        "classification",
        "access_route"
      ],
      "retrieved_at": "2026-08-14T00:00:00Z"
    }
  ],
  "blockers": []
}
